{
  "id": "leveling-up",
  "license": "CC0-1.0",
  "name": "Leveling Up",
  "sources": [
    {
      "imported_at": "2026-07-25",
      "ref": "B0DJMYV4BJ",
      "type": "audiosilo-books-import"
    }
  ],
  "works": [
    {
      "position": "4",
      "work": "magical-midlife-love-dramatized-adaptation"
    },
    {
      "position": "1",
      "work": "magical-midlife-madness-dramatized-adaptation"
    },
    {
      "position": "3",
      "work": "magical-midlife-invasion-dramatized-adaptation"
    },
    {
      "position": "2",
      "work": "magical-midlife-dating-dramatized-adaptation"
    },
    {
      "position": "5",
      "work": "magical-midlife-meeting-dramatized-adaptation"
    },
    {
      "position": "6",
      "work": "magical-midlife-challenge-dramatized-adaptation"
    },
    {
      "position": "7",
      "work": "magical-midlife-alliance"
    },
    {
      "position": "9",
      "work": "magical-midlife-battle"
    },
    {
      "position": "10",
      "work": "magical-midlife-awakening"
    },
    {
      "position": "11",
      "work": "magical-midlife-rescue"
    },
    {
      "position": "12",
      "work": "magical-midlife-rogue"
    },
    {
      "position": "8",
      "work": "magical-midlife-flowers-dramatized-adaptation"
    }
  ]
}
