{
  "id": "catherine-ling",
  "license": "CC0-1.0",
  "name": "Catherine Ling",
  "sources": [
    {
      "imported_at": "2026-07-25",
      "ref": "B00W84A4WU",
      "type": "audiosilo-books-import"
    }
  ],
  "works": [
    {
      "position": "4",
      "work": "your-next-breath"
    },
    {
      "position": "2",
      "work": "what-doesnt-kill-you"
    },
    {
      "position": "3",
      "work": "live-to-see-tomorrow"
    },
    {
      "position": "1",
      "work": "chasing-the-night"
    }
  ]
}
