{
  "id": "discworld-death",
  "license": "CC0-1.0",
  "name": "Discworld: Death",
  "sources": [
    {
      "imported_at": "2026-07-25",
      "ref": "B09LZ3PWYB",
      "type": "audiosilo-books-import"
    }
  ],
  "works": [
    {
      "position": "5",
      "work": "thief-of-time"
    },
    {
      "position": "4",
      "work": "hogfather"
    },
    {
      "position": "1",
      "work": "mort"
    }
  ]
}
