{
  "id": "the-night-huntress-novels",
  "license": "CC0-1.0",
  "name": "The Night Huntress Novels",
  "sources": [
    {
      "imported_at": "2026-07-25",
      "ref": "B0CKWGNL6T",
      "type": "audiosilo-books-import"
    }
  ],
  "works": [
    {
      "position": "5",
      "work": "this-side-of-the-grave-dramatized-adaptation"
    },
    {
      "position": "4.5",
      "work": "one-for-the-money-dramatized-adaptation"
    },
    {
      "position": "3",
      "work": "at-graves-end-dramatized-adaptation"
    },
    {
      "position": "4",
      "work": "destined-for-an-early-grave-dramatized-adaptation"
    },
    {
      "position": "2",
      "work": "one-foot-in-the-grave-dramatized-adaptation"
    },
    {
      "position": "1",
      "work": "halfway-to-the-grave-dramatized-adaptation"
    },
    {
      "position": "9",
      "work": "the-other-half-of-the-grave"
    },
    {
      "position": "10",
      "work": "both-feet-in-the-grave"
    },
    {
      "position": "6",
      "work": "one-grave-at-a-time"
    },
    {
      "position": "7.5",
      "work": "outtakes-from-the-grave"
    },
    {
      "position": "8",
      "work": "a-grave-girls-getaway"
    },
    {
      "position": "7",
      "work": "up-from-the-grave-dramatized-adaptation"
    },
    {
      "position": "3.5",
      "work": "devil-to-pay"
    },
    {
      "position": "1.5",
      "work": "happily-never-after"
    },
    {
      "position": "0.5",
      "work": "reckoning-jeaniene-frost"
    },
    {
      "position": "6.5",
      "work": "home-for-the-holidays"
    }
  ]
}
