{
  "id": "the-cosmere",
  "license": "CC0-1.0",
  "name": "The Cosmere",
  "sources": [
    {
      "imported_at": "2026-07-11",
      "ref": "1473231051",
      "type": "openaudible-import"
    }
  ],
  "works": [
    {
      "position": "4",
      "work": "rhythm-of-war"
    },
    {
      "position": "5",
      "work": "wind-and-truth"
    }
  ]
}
